{
  "slug": "lisbon",
  "metadata": {
    "dates_start": "2026-08-14",
    "dates_end": "2026-08-18",
    "origin": "Manila",
    "destination": "Lisbon",
    "passport": "PH",
    "pax": 2,
    "base_hotel_area": "Bairro Alto",
    "currency_code": "EUR",
    "fx_rate_to_sgd": 0.68,
    "fx_rate_anchor_date": "2026-05-29",
    "climate_summary": "Lisbon mid-August: hot dry 30-35C, virtually no rain, strong Atlantic sea breeze PM, heat-wave risk 14:00-17:00 block",
    "power_plug": "Type F (Schuko)",
    "weather_risk": "low",
    "tap_water": "Potable — safe to drink from tap",
    "tipping": "Round up or 5-10% in restaurants; not mandatory",
    "emergency": "112 universal (police + ambulance + fire)"
  },
  "visa": {
    "rule": "Schengen short-stay visa required for PH passport holders; apply at Portuguese consulate (Manila). 90-day maximum in any 180-day window.",
    "days_allowed": 90,
    "e_visa_required": false,
    "passport_validity_required_until": "2027-02-14",
    "onward_ticket_required": true,
    "source": "https://www.vfsglobal.com/portugal/philippines/"
  },
  "places": [
    {
      "key": "belem_tower",
      "name": "Torre de Belém",
      "category": "iconic",
      "area": "Belém",
      "wiki_title": "Belem_Tower",
      "description": "UNESCO-listed Manueline limestone tower built 1516-1519 on the Tagus riverbank. Entry €6; advance tickets recommended. Climb is narrow — not suitable for claustrophobics.",
      "distance_km_from_base": 6.5,
      "travel_min_from_base": 25,
      "price_local": 6,
      "price_label": "€6",
      "when": "Day 2 morning",
      "indoor": false,
      "duration": "1hr",
      "opening_hours": "Tue-Sun 10:00-17:30 (last entry 17:00)",
      "links": [
        {
          "label": "Official site",
          "url": "https://www.torrebelem.gov.pt/"
        }
      ],
      "lat": 38.691586,
      "lon": -9.2159288
    },
    {
      "key": "jeronimos_monastery",
      "name": "Mosteiro dos Jerónimos",
      "category": "iconic",
      "area": "Belém",
      "wiki_title": "Jerónimos_Monastery",
      "description": "Masterpiece of Manueline Gothic architecture, completed 1601. Houses tombs of Vasco da Gama and poet Luís de Camões. €12 entry; arrive before 10:00 to beat tour groups.",
      "distance_km_from_base": 6.2,
      "travel_min_from_base": 24,
      "price_local": 12,
      "price_label": "€12",
      "when": "Day 2 morning",
      "indoor": true,
      "duration": "1.5hr",
      "opening_hours": "Tue-Sun 09:30-18:00 (Oct-Apr 17:00)",
      "links": [
        {
          "label": "Official site",
          "url": "https://www.mosteirojeronimos.gov.pt/"
        }
      ],
      "lat": 38.6977577,
      "lon": -9.2066239
    },
    {
      "key": "praca_comercio",
      "name": "Praça do Comércio",
      "category": "iconic",
      "area": "Baixa",
      "wiki_title": "Praça_do_Comércio",
      "description": "Massive riverfront square framed by arcaded yellow buildings, opened post-1755 earthquake. Bronze equestrian statue of King José I at centre. Rua Augusta triumphal arch leads north. Free.",
      "distance_km_from_base": 1.4,
      "travel_min_from_base": 8,
      "price_local": 0,
      "price_label": "Free",
      "when": "Day 1 afternoon",
      "indoor": false,
      "duration": "45min",
      "opening_hours": "24h",
      "links": [],
      "lat": 38.7088579,
      "lon": -9.1360541
    },
    {
      "key": "tram_28",
      "name": "Tram 28 (Eléctrico 28)",
      "category": "iconic",
      "area": "Graça–Alfama",
      "wiki_title": "Lisbon_tram_28",
      "description": "Historic yellow wooden tram running through Alfama's steep alleys from Martim Moniz to Campo Ourique. Ride full route for €3.10 with Lisboa Viva card. Crowded midday — board at Graça terminus for a seat.",
      "distance_km_from_base": 1.8,
      "travel_min_from_base": 10,
      "price_local": 3,
      "price_label": "€3",
      "when": "Day 3 morning",
      "indoor": false,
      "duration": "40min",
      "opening_hours": "06:00-23:00 daily",
      "links": [],
      "alt_search_query": "Lisbon tram 28 historic yellow tram Alfama"
    },
    {
      "key": "miradouro_senhora_monte",
      "name": "Miradouro da Senhora do Monte",
      "category": "hidden_gem",
      "area": "Graça",
      "description": "Highest viewpoint in central Lisbon, overlooking São Jorge Castle, the Tagus, and Alfama rooftops. Less visited than Portas do Sol. Small chapel beside the terrace. Free, no facilities.",
      "distance_km_from_base": 2.2,
      "travel_min_from_base": 12,
      "price_local": 0,
      "price_label": "Free",
      "when": "Day 3 sunset",
      "indoor": false,
      "duration": "45min",
      "opening_hours": "24h",
      "links": [],
      "alt_search_query": "Miradouro da Senhora do Monte Lisbon viewpoint Graça"
    },
    {
      "key": "lx_factory",
      "name": "LX Factory",
      "category": "hidden_gem",
      "area": "Alcântara",
      "description": "Repurposed 19th-century textile factory turned creative hub: independent shops, bookstore Ler Devagar (with a swing), restaurants, weekend market Sunday 10:00-18:00. Free to enter; individual shops vary.",
      "distance_km_from_base": 2.8,
      "travel_min_from_base": 14,
      "price_local": 0,
      "price_label": "Free entry",
      "when": "Day 4 morning",
      "indoor": true,
      "duration": "2hr",
      "opening_hours": "Daily 10:00-23:00 (market Sun 10:00-18:00)",
      "links": [
        {
          "label": "Official",
          "url": "https://www.lxfactory.com/"
        }
      ],
      "lat": 38.7026001,
      "lon": -9.1786619,
      "alt_search_query": "LX Factory Alcântara Lisbon creative hub"
    },
    {
      "key": "manteigaria",
      "name": "Manteigaria – Fábrica de Pastéis de Nata",
      "category": "food",
      "area": "Chiado",
      "wiki_title": "Pastel_de_nata",
      "alt_search_query": "Manteigaria pasteis de nata Chiado Lisbon",
      "description": "Standing-room pastry counter in Chiado producing fresh pastéis de nata every 15 minutes. €1.40 per tart, best eaten warm with cinnamon and icing sugar. Queue moves fast.",
      "distance_km_from_base": 0.4,
      "travel_min_from_base": 5,
      "price_local": 2,
      "price_label": "€1.40-2/tart",
      "when": "Day 1 afternoon",
      "indoor": true,
      "duration": "20min",
      "opening_hours": "Daily 08:00-00:00",
      "links": []
    },
    {
      "key": "pasteis_belem",
      "name": "Pastéis de Belém",
      "category": "food",
      "area": "Belém",
      "wiki_title": "Pastéis_de_Belém",
      "description": "Original 1837 source of the custard tart recipe; the filling formula is a closely guarded secret. Takes on Blue Willow-pattern tiles. Price €1.40/tart. Queue can be 30min but moves quickly.",
      "distance_km_from_base": 6.4,
      "travel_min_from_base": 25,
      "price_local": 2,
      "price_label": "€1.40/tart",
      "when": "Day 2 morning",
      "indoor": true,
      "duration": "30min",
      "opening_hours": "Daily 08:00-23:00",
      "links": [
        {
          "label": "Official",
          "url": "https://www.pasteisdebelem.pt/"
        }
      ],
      "lat": 38.6974795,
      "lon": -9.2033202
    },
    {
      "key": "tasca_do_chico",
      "name": "Tasca do Chico",
      "category": "food",
      "area": "Bairro Alto",
      "alt_search_query": "Tasca do Chico fado restaurant Bairro Alto Lisbon",
      "description": "Small wood-panelled tasca in Bairro Alto offering live fado music nightly at 20:00, free with your meal. Menu of petiscos (sharing plates): chouriço flambé, octopus salad, bacalhau. Reservation essential.",
      "distance_km_from_base": 0.3,
      "travel_min_from_base": 3,
      "price_local": 35,
      "price_label": "€30-45pp",
      "when": "Day 1 evening",
      "indoor": true,
      "duration": "2hr",
      "opening_hours": "Mon-Sat 19:30-24:00",
      "links": [],
      "lat": 38.7116311,
      "lon": -9.144132
    },
    {
      "key": "time_out_market",
      "name": "Time Out Market Lisboa",
      "category": "food",
      "area": "Cais do Sodré",
      "wiki_title": "Time_Out_Market_Lisboa",
      "description": "Curated food hall in the 1882 Mercado da Ribeira: 35+ stalls including starred-chef counters (Henrique Sá Pessoa), ginjinha bar, fresh seafood. Covered, air-conditioned. Open daily.",
      "distance_km_from_base": 1.1,
      "travel_min_from_base": 6,
      "price_local": 15,
      "price_label": "€12-20pp",
      "when": "Day 4 lunch",
      "indoor": true,
      "duration": "1.5hr",
      "opening_hours": "Sun-Wed 10:00-00:00, Thu-Sat 10:00-02:00",
      "links": [
        {
          "label": "Official",
          "url": "https://www.timeoutmarket.com/lisboa/"
        }
      ]
    },
    {
      "key": "bairro_alto_bars",
      "name": "Bairro Alto Bar Crawl",
      "category": "nightlife",
      "area": "Bairro Alto",
      "wiki_title": "Bairro_Alto",
      "description": "Dense grid of narrow streets (Rua da Atalaia, Rua do Norte, Rua Diário de Notícias) packed with independent bars. Bars open doors from 22:00; street drinking with plastic cups is tolerated. Budget €3-5 per beer.",
      "distance_km_from_base": 0.2,
      "travel_min_from_base": 2,
      "price_local": 5,
      "price_label": "€3-5/drink",
      "when": "Day 1 night",
      "indoor": false,
      "duration": "2hr",
      "opening_hours": "22:00-03:00 (peak nights Thu-Sat)",
      "links": []
    },
    {
      "key": "pink_street",
      "name": "Pink Street (Rua Nova do Carvalho)",
      "category": "nightlife",
      "area": "Cais do Sodré",
      "description": "700m street painted bright pink, formerly a red-light district, now a lineup of late-night bars and clubs. Bicaense, Pensão Amor, and Sol e Pesca are anchors. Heats up after midnight.",
      "distance_km_from_base": 1.2,
      "travel_min_from_base": 7,
      "price_local": 10,